[
  {
    "route_number": "102",
    "municipality": "tula",
    "transport_type": "bus",
    "stop": "пос. Шатск",
    "days": [
      "ежедневно"
    ],
    "times": [
      "05:50",
      "06:20",
      "07:20",
      "08:15",
      "09:15",
      "10:20",
      "12:30",
      "14:30",
      "16:25",
      "17:35",
      "19:20",
      "20:00",
      "20:35"
    ],
    "notes": [
      "",
      "до ст. Металлург",
      "",
      "",
      "",
      "",
      "",
      "",
      "",
      "",
      "до ст. Металлург",
      "до ст. Металлург",
      "до ст. Металлург"
    ],
    "source_url": "https://tula-r71.gosweb.gosuslugi.ru/netcat_files/userfiles/transport/102-.docx",
    "fetched_at": "2026-09-24"
  },
  {
    "route_number": "102",
    "municipality": "tula",
    "transport_type": "bus",
    "stop": "Тулы",
    "days": [
      "ежедневно"
    ],
    "times": [
      "05:40",
      "06:50",
      "07:15",
      "08:20",
      "09:20",
      "11:30",
      "13:35",
      "15:30",
      "16:30",
      "18:20",
      "19:00",
      "20:05"
    ],
    "notes": [
      "cо ст. Металлург",
      "cо ст. Металлург",
      "",
      "",
      "",
      "",
      "",
      "",
      "",
      "",
      "",
      "cо ст. Металлург"
    ],
    "source_url": "https://tula-r71.gosweb.gosuslugi.ru/netcat_files/userfiles/transport/102-.docx",
    "fetched_at": "2026-09-24"
  },
  {
    "route_number": "10Л",
    "municipality": "tula",
    "transport_type": "bus",
    "stop": "мкр. Северная Мыза",
    "days": [
      "будни"
    ],
    "times": [
      "06:15",
      "06:30",
      "06:45",
      "07:00",
      "07:10",
      "07:30",
      "07:50",
      "08:10",
      "08:30",
      "08:50",
      "09:10",
      "09:30",
      "09:50",
      "10:10",
      "10:30",
      "10:50",
      "11:10",
      "11:30",
      "11:50",
      "12:10",
      "12:30",
      "12:50",
      "13:10",
      "13:30",
      "14:05",
      "14:40",
      "15:00",
      "15:20",
      "15:40",
      "16:00",
      "16:20",
      "16:40",
      "17:00",
      "17:20",
      "17:40",
      "18:00",
      "18:20",
      "18:40",
      "19:00",
      "19:20",
      "19:40",
      "20:00",
      "20:20"
    ],
    "notes": [
      "",
      "",
      "",
      "",
      "",
      "",
      "",
      "",
      "",
      "",
      "",
      "",
      "",
      "",
      "",
      "",
      "",
      "",
      "",
      "",
      "",
      "",
      "",
      "",
      "",
      "",
      "",
      "",
      "",
      "",
      "",
      "",
      "",
      "",
      "",
      "",
      "",
      "",
      "",
      "",
      "",
      "",
      ""
    ],
    "source_url": "https://tula-r71.gosweb.gosuslugi.ru/netcat_files/userfiles/transport/10l-.docx",
    "fetched_at": "2026-09-24"
  },
  {
    "route_number": "10Л",
    "municipality": "tula",
    "transport_type": "bus",
    "stop": "Тульский областной онкологический диспансер",
    "days": [
      "будни"
    ],
    "times": [
      "06:00",
      "06:15",
      "06:30",
      "06:45",
      "07:10",
      "07:30",
      "07:50",
      "08:05",
      "08:20",
      "08:40",
      "09:00",
      "09:20",
      "09:40",
      "10:00",
      "10:20",
      "10:40",
      "11:00",
      "11:20",
      "11:40",
      "12:00",
      "12:20",
      "12:50",
      "13:30",
      "13:50",
      "14:10",
      "14:30",
      "14:50",
      "15:10",
      "15:30",
      "15:50",
      "16:10",
      "16:30",
      "16:50",
      "17:10",
      "17:30",
      "17:50",
      "18:10",
      "18:30",
      "18:50",
      "19:10",
      "19:30",
      "19:50",
      "20:50"
    ],
    "notes": [
      "",
      "",
      "",
      "",
      "",
      "",
      "",
      "",
      "",
      "",
      "",
      "",
      "",
      "",
      "",
      "",
      "",
      "",
      "",
      "",
      "",
      "",
      "",
      "",
      "",
      "",
      "",
      "",
      "",
      "",
      "",
      "",
      "",
      "",
      "",
      "",
      "",
      "",
      "",
      "",
      "",
      "",
      ""
    ],
    "source_url": "https://tula-r71.gosweb.gosuslugi.ru/netcat_files/userfiles/transport/10l-.docx",
    "fetched_at": "2026-09-24"
  },
  {
    "route_number": "10Л",
    "municipality": "tula",
    "transport_type": "bus",
    "stop": "мкр. Северная Мыза",
    "days": [
      "выходные"
    ],
    "times": [
      "06:15",
      "06:30",
      "06:45",
      "07:10",
      "07:30",
      "07:50",
      "08:10",
      "08:30",
      "08:50",
      "09:30",
      "09:50",
      "10:10",
      "10:30",
      "10:50",
      "11:10",
      "11:50",
      "12:10",
      "12:30",
      "12:50",
      "13:10",
      "13:30",
      "14:40",
      "15:00",
      "15:20",
      "15:40",
      "16:00",
      "16:30",
      "17:00",
      "17:20",
      "17:40",
      "18:00",
      "18:20",
      "18:40",
      "19:20",
      "19:40",
      "20:00",
      "20:20"
    ],
    "notes": [
      "",
      "",
      "",
      "",
      "",
      "",
      "",
      "",
      "",
      "",
      "",
      "",
      "",
      "",
      "",
      "",
      "",
      "",
      "",
      "",
      "",
      "",
      "",
      "",
      "",
      "",
      "",
      "",
      "",
      "",
      "",
      "",
      "",
      "",
      "",
      "",
      ""
    ],
    "source_url": "https://tula-r71.gosweb.gosuslugi.ru/netcat_files/userfiles/transport/10l-.docx",
    "fetched_at": "2026-09-24"
  },
  {
    "route_number": "10Л",
    "municipality": "tula",
    "transport_type": "bus",
    "stop": "Тульский областной онкологический диспансер",
    "days": [
      "выходные"
    ],
    "times": [
      "06:15",
      "06:30",
      "06:45",
      "07:10",
      "07:30",
      "07:50",
      "08:20",
      "08:40",
      "09:00",
      "09:20",
      "09:40",
      "10:00",
      "10:40",
      "11:00",
      "11:20",
      "11:40",
      "12:00",
      "12:20",
      "13:30",
      "13:50",
      "14:10",
      "14:30",
      "14:50",
      "15:10",
      "15:50",
      "16:10",
      "16:30",
      "16:50",
      "17:10",
      "17:30",
      "18:10",
      "18:30",
      "18:50",
      "19:10",
      "19:30",
      "19:50",
      "20:50"
    ],
    "notes": [
      "",
      "",
      "",
      "",
      "",
      "",
      "",
      "",
      "",
      "",
      "",
      "",
      "",
      "",
      "",
      "",
      "",
      "",
      "",
      "",
      "",
      "",
      "",
      "",
      "",
      "",
      "",
      "",
      "",
      "",
      "",
      "",
      "",
      "",
      "",
      "",
      ""
    ],
    "source_url": "https://tula-r71.gosweb.gosuslugi.ru/netcat_files/userfiles/transport/10l-.docx",
    "fetched_at": "2026-09-24"
  },
  {
    "route_number": "12",
    "municipality": "tula",
    "transport_type": "bus",
    "stop": "Птицефабрики",
    "days": [
      "будни"
    ],
    "times": [
      "06:10",
      "06:25",
      "06:39",
      "06:54",
      "07:09",
      "07:28",
      "07:47",
      "08:07",
      "08:26",
      "08:45",
      "09:04",
      "09:23",
      "10:01",
      "10:35",
      "11:07",
      "11:25",
      "11:42",
      "11:58",
      "12:14",
      "12:30",
      "12:46",
      "13:02",
      "13:19",
      "13:36",
      "13:53",
      "14:09",
      "14:25",
      "14:41",
      "14:57",
      "15:30",
      "15:47",
      "16:04",
      "16:20",
      "16:36",
      "16:52",
      "17:26",
      "17:42",
      "17:58",
      "18:16",
      "18:39",
      "19:05",
      "19:53",
      "20:12",
      "21:12",
      "22:12",
      "23:12",
      "23:57"
    ],
    "notes": [
      "",
      "",
      "",
      "",
      "",
      "",
      "",
      "",
      "",
      "",
      "",
      "",
      "",
      "",
      "",
      "",
      "",
      "",
      "",
      "",
      "",
      "",
      "",
      "",
      "",
      "",
      "",
      "",
      "",
      "",
      "",
      "",
      "",
      "",
      "",
      "",
      "",
      "",
      "",
      "",
      "",
      "",
      "",
      "",
      "",
      "",
      ""
    ],
    "source_url": "https://tula-r71.gosweb.gosuslugi.ru/netcat_files/userfiles/transport/12a-.zip",
    "fetched_at": "2026-09-24"
  },
  {
    "route_number": "12",
    "municipality": "tula",
    "transport_type": "bus",
    "stop": "РТИ",
    "days": [
      "будни"
    ],
    "times": [
      "05:54",
      "06:09",
      "06:25",
      "06:40",
      "06:55",
      "07:10",
      "07:29",
      "07:48",
      "08:07",
      "08:26",
      "08:45",
      "09:04",
      "09:24",
      "09:43",
      "10:02",
      "10:36",
      "11:08",
      "11:40",
      "11:56",
      "12:12",
      "12:30",
      "12:47",
      "13:03",
      "13:19",
      "13:35",
      "13:51",
      "14:07",
      "14:23",
      "14:58",
      "15:14",
      "15:30",
      "15:46",
      "16:02",
      "16:18",
      "16:34",
      "16:52",
      "17:09",
      "17:41",
      "17:57",
      "18:13",
      "18:47",
      "19:19",
      "21:12",
      "22:12"
    ],
    "notes": [
      "",
      "",
      "",
      "",
      "",
      "",
      "",
      "",
      "",
      "",
      "",
      "",
      "",
      "",
      "",
      "",
      "",
      "",
      "",
      "",
      "",
      "",
      "",
      "",
      "",
      "",
      "",
      "",
      "",
      "",
      "",
      "",
      "",
      "",
      "",
      "",
      "",
      "",
      "",
      "",
      "",
      "",
      "",
      ""
    ],
    "source_url": "https://tula-r71.gosweb.gosuslugi.ru/netcat_files/userfiles/transport/12a-.zip",
    "fetched_at": "2026-09-24"
  },
  {
    "route_number": "12",
    "municipality": "tula",
    "transport_type": "bus",
    "stop": "Птицефабрики",
    "days": [
      "выходные"
    ],
    "times": [
      "06:22",
      "06:41",
      "07:01",
      "07:23",
      "07:45",
      "08:07",
      "08:29",